{"name":"Lingsha","rarity":5,"element":"fire","weaponType":"abundance","bannerName":"???","colors":{"primary":"bg-gradient-to-r from-[#392916] to-[#D88F45]","secondary":"bg-gradient-to-t from-[#392916] to-[#8F541700]","textAccent":"text-[#D88F45]"},"images":{"gachaSplash":"lingsha/gachaSpash","gachaCard":"lingsha/gachaCard","bannerCard":"lingsha/bannerCard"}}