{
  "name": "Calcharo",
  "rarity": 5,
  "element": "electro",
  "weaponType": "broadblade",
  "bannerName": "?????",
  "images": {
    "gachaSplash": "./assets/characters/wuwa/calcharo/gachaSpash.png",
    "gachaCard": "./assets/characters/wuwa/calcharo/gachaCard.png",
    "bannerCard": "./assets/characters/wuwa/calcharo/bannerCard.png"
  },
  "colors": {
    "primary": "bg-gradient-to-r from-[#000] to-[#fff]",
    "secondary": "bg-gradient-to-t from-[#000] to-[#ffffff00]",
    "textAccent": "text-[#999]"
  }
}
