{
  "name": "Natasha",
  "rarity": 4,
  "element": "physical",
  "images": {
    "gachaSplash": "./images/characters/starrail/natasha/gachaSpash.png",
    "gachaCard": "./images/characters/starrail/natasha/gachaCard.png",
    "bannerCard": "./images/characters/starrail/natasha/bannerCard.png"
  }
}
