{
  "name": "Misha",
  "rarity": 4,
  "element": "ice",
  "weaponType": "destruction",
  "images": {
    "gachaSplash": "/assets/characters/starrail/misha/gachaSpash",
    "gachaCard": "/assets/characters/starrail/misha/gachaCard",
    "bannerCard": "/assets/characters/starrail/misha/bannerCard"
  }
}
