{
  "name": "Hanya",
  "rarity": 4,
  "element": "physical",
  "weaponType": "harmony",
  "images": {
    "gachaSplash": "/assets/characters/starrail/hanya/gachaSpash",
    "gachaCard": "/assets/characters/starrail/hanya/gachaCard",
    "bannerCard": "/assets/characters/starrail/hanya/bannerCard"
  }
}
