{
  "name": "Jinhsi",
  "rarity": 5,
  "element": "spectro",
  "weaponType": "broadblade",
  "bannerName": "?????",
  "images": {
    "gachaSplash": "./assets/characters/wuwa/jinhsi/gachaSpash.png",
    "gachaCard": "./assets/characters/wuwa/jinhsi/gachaCard.png",
    "bannerCard": "./assets/characters/wuwa/jinhsi/bannerCard.png"
  },
  "colors": {
    "primary": "bg-gradient-to-r from-[#000] to-[#fff]",
    "secondary": "bg-gradient-to-t from-[#000] to-[#ffffff00]",
    "textAccent": "text-[#999]"
  }
}
