{
  "name": "Kafka",
  "rarity": 5,
  "element": "lightning",
  "weaponType": "nihility",
  "bannerName": "Nessun Dorma",
  "colors": {
    "primary": "bg-gradient-to-r from-[#000] to-[#fff]",
    "secondary": "bg-gradient-to-t from-[#000] to-[#ffffff00]",
    "textAccent": "text-[#999]"
  },
  "images": {
    "gachaSplash": "./images/characters/kafaka/gachaSpash.png",
    "gachaCard": "./images/characters/kafaka/gachaCard.png",
    "bannerCard": "./images/characters/kafaka/bannerCard.png"
  }
}
