{
  "name": "Feixiao",
  "rarity": 5,
  "element": "starrail",
  "weaponType": "starrail",
  "bannerName": "???",
  "colors": {
    "primary": "bg-gradient-to-r from-[#000] to-[#fff]",
    "secondary": "bg-gradient-to-t from-[#000] to-[#ffffff00]",
    "textAccent": "text-[#999]"
  },
  "images": {
    "gachaSplash": "./images/characters/feixiao/gachaSpash.png",
    "gachaCard": "./images/characters/feixiao/gachaCard.png",
    "bannerCard": "./images/characters/feixiao/bannerCard.png"
  }
}
