{
  "name": "Bronya",
  "rarity": 5,
  "element": "wind",
  "weaponType": "harmony",
  "bannerName": "",
  "colors": {
    "primary": "bg-gradient-to-r from-[#000] to-[#fff]",
    "secondary": "bg-gradient-to-t from-[#000] to-[#ffffff00]",
    "textAccent": "text-[#999]"
  },
  "images": {
    "gachaSplash": "/assets/characters/starrail/bronya/gachaSpash",
    "gachaCard": "/assets/characters/starrail/bronya/gachaCard",
    "bannerCard": "/assets/characters/starrail/bronya/bannerCard"
  }
}
