{
	"name": "Xilonen",
	"rarity": 5,
	"element": "geo",
	"weaponType": "Sword",
	"bannerName": "?????",
	"images": {
		"gachaSplash": "xilonen/gachaSplash",
		"gachaCard": "xilonen/gachaCard",
		"bannerCard": "xilonen/bannerCard"
	},
	"colors": {
		"primary": "bg-gradient-to-r from-[#000] to-[#fff]",
		"secondary": "bg-gradient-to-t from-[#000] to-[#fff00]",
		"textAccent": "text-[#fff]"
	}
}
